{
  "application_policy": "annotation_only_no_manifest_application",
  "function_proposals": [],
  "input_plan": {
    "file": "fable2-indirect-targets.import-plan.json",
    "plan_id": "P4PLAN-EF5A9BE6D31FDB8BD309",
    "sha256": "446EF1C3EE0899AF1EF6278AD52D79E0538B4E72703940EBDE23550FD25C18AA"
  },
  "ledger_sha256": "2854BA326303C813148792D4D830444B2879FE294756B99C82D3C50D42B3328E",
  "schema": {
    "name": "fable2-ownership-reviewed-plan",
    "version": 1
  },
  "targets": [
    {
      "action": "retain_owner_no_promotion",
      "owner": "0x82176248",
      "phase4_candidate_id": "P4-19666ADCDB1779AD",
      "phase4_category": "existing_function_internal_entry",
      "semantic_classification": "return_continuation",
      "target": "0x8217627C"
    },
    {
      "action": "retain_owner_no_promotion",
      "owner": "0x82181828",
      "phase4_candidate_id": "P4-9E5FFC16C32F1134",
      "phase4_category": "existing_function_internal_entry",
      "semantic_classification": "return_continuation",
      "target": "0x821818C4"
    },
    {
      "action": "retain_owner_no_promotion",
      "owner": "0x82184C48",
      "phase4_candidate_id": "P4-339904982F8ACCEE",
      "phase4_category": "existing_function_internal_entry",
      "semantic_classification": "return_continuation",
      "target": "0x82184CD0"
    },
    {
      "action": "retain_owner_no_promotion",
      "owner": "0x821BD798",
      "phase4_candidate_id": "P4-BE7635459F8F3F79",
      "phase4_category": "existing_function_internal_entry",
      "semantic_classification": "return_continuation",
      "target": "0x821BD8A8"
    },
    {
      "action": "retain_owner_no_promotion",
      "owner": "0x821E14F0",
      "phase4_candidate_id": "P4-3730A28A6F7FAED5",
      "phase4_category": "existing_function_internal_entry",
      "semantic_classification": "return_continuation",
      "target": "0x821E169C"
    },
    {
      "action": "retain_owner_no_promotion",
      "owner": "0x82302270",
      "phase4_candidate_id": "P4-520A3D715981349D",
      "phase4_category": "existing_function_internal_entry",
      "semantic_classification": "return_continuation",
      "target": "0x823024D8"
    },
    {
      "action": "retain_owner_no_promotion",
      "owner": "0x82302270",
      "phase4_candidate_id": "P4-8A9822E7C203F631",
      "phase4_category": "existing_function_internal_entry",
      "semantic_classification": "return_continuation",
      "target": "0x82302538"
    },
    {
      "action": "retain_owner_no_promotion",
      "owner": "0x82302270",
      "phase4_candidate_id": "P4-7D777A9621A4268B",
      "phase4_category": "existing_function_internal_entry",
      "semantic_classification": "return_continuation",
      "target": "0x82302598"
    },
    {
      "action": "retain_owner_no_promotion",
      "owner": "0x82302F68",
      "phase4_candidate_id": "P4-4CC5B50DD8367BF7",
      "phase4_category": "existing_function_internal_entry",
      "semantic_classification": "return_continuation",
      "target": "0x8230303C"
    },
    {
      "action": "retain_owner_no_promotion",
      "owner": "0x82302F68",
      "phase4_candidate_id": "P4-916E0F0297C3A7FC",
      "phase4_category": "existing_function_internal_entry",
      "semantic_classification": "return_continuation",
      "target": "0x823031FC"
    },
    {
      "action": "retain_owner_no_promotion",
      "owner": "0x82302F68",
      "phase4_candidate_id": "P4-CF4A2F98E0C7A697",
      "phase4_category": "existing_function_internal_entry",
      "semantic_classification": "return_continuation",
      "target": "0x82303244"
    },
    {
      "action": "retain_owner_no_promotion",
      "owner": "0x82307050",
      "phase4_candidate_id": "P4-32B146985B716A31",
      "phase4_category": "existing_function_internal_entry",
      "semantic_classification": "return_continuation",
      "target": "0x82307084"
    },
    {
      "action": "retain_owner_no_promotion",
      "owner": "0x823D1A48",
      "phase4_candidate_id": "P4-BCE042D5CA0DAD97",
      "phase4_category": "existing_function_internal_entry",
      "semantic_classification": "return_continuation",
      "target": "0x823D1CA0"
    },
    {
      "action": "retain_owner_no_promotion",
      "owner": "0x82413BB8",
      "phase4_candidate_id": "P4-E5DEC1BBE2526E06",
      "phase4_category": "existing_function_internal_entry",
      "semantic_classification": "return_continuation",
      "target": "0x82414130"
    },
    {
      "action": "retain_owner_no_promotion",
      "owner": "0x8242AD40",
      "phase4_candidate_id": "P4-7DCC8EC49C517D76",
      "phase4_category": "existing_function_internal_entry",
      "semantic_classification": "return_continuation",
      "target": "0x8242ADA0"
    },
    {
      "action": "retain_owner_no_promotion",
      "owner": "0x8242AD40",
      "phase4_candidate_id": "P4-D4866CB9D83351F5",
      "phase4_category": "existing_function_internal_entry",
      "semantic_classification": "return_continuation",
      "target": "0x8242AF40"
    },
    {
      "action": "retain_owner_no_promotion",
      "owner": "0x8242B108",
      "phase4_candidate_id": "P4-DC811CD67BCC2CEE",
      "phase4_category": "existing_function_internal_entry",
      "semantic_classification": "return_continuation",
      "target": "0x8242B1A4"
    },
    {
      "action": "retain_owner_no_promotion",
      "owner": "0x82474B30",
      "phase4_candidate_id": "P4-7C0ED2CF4E4E63D3",
      "phase4_category": "existing_function_internal_entry",
      "semantic_classification": "return_continuation",
      "target": "0x82474C38"
    },
    {
      "action": "retain_owner_no_promotion",
      "owner": "0x824BE488",
      "phase4_candidate_id": "P4-00C4DCDB77676B27",
      "phase4_category": "existing_function_internal_entry",
      "semantic_classification": "return_continuation",
      "target": "0x824BE7DC"
    },
    {
      "action": "retain_owner_no_promotion",
      "owner": "0x8279B778",
      "phase4_candidate_id": "P4-6E9709EBA7B31E99",
      "phase4_category": "existing_function_internal_entry",
      "semantic_classification": "return_continuation",
      "target": "0x8279B8D0"
    },
    {
      "action": "retain_owner_no_promotion",
      "owner": "0x8279E818",
      "phase4_candidate_id": "P4-BF8296430892EF47",
      "phase4_category": "existing_function_internal_entry",
      "semantic_classification": "return_continuation",
      "target": "0x8279E9CC"
    },
    {
      "action": "retain_owner_no_promotion",
      "owner": "0x827A5888",
      "phase4_candidate_id": "P4-71E440454EEF8930",
      "phase4_category": "existing_function_internal_entry",
      "semantic_classification": "return_continuation",
      "target": "0x827A59F0"
    },
    {
      "action": "retain_owner_no_promotion",
      "owner": "0x828203B8",
      "phase4_candidate_id": "P4-863FF1B8100A853E",
      "phase4_category": "existing_function_internal_entry",
      "semantic_classification": "return_continuation",
      "target": "0x828205A0"
    },
    {
      "action": "retain_owner_no_promotion",
      "owner": "0x828DD360",
      "phase4_candidate_id": "P4-872B34A31EC12B49",
      "phase4_category": "existing_function_internal_entry",
      "semantic_classification": "return_continuation",
      "target": "0x828DD4C8"
    },
    {
      "action": "retain_owner_no_promotion",
      "owner": "0x828E1908",
      "phase4_candidate_id": "P4-63071119524F60F2",
      "phase4_category": "existing_function_internal_entry",
      "semantic_classification": "return_continuation",
      "target": "0x828E19DC"
    },
    {
      "action": "retain_owner_no_promotion",
      "owner": "0x8296C010",
      "phase4_candidate_id": "P4-8D26DD3151EC0C92",
      "phase4_category": "existing_function_internal_entry",
      "semantic_classification": "return_continuation",
      "target": "0x8296C148"
    },
    {
      "action": "retain_owner_no_promotion",
      "owner": "0x829907F0",
      "phase4_candidate_id": "P4-9BA338FA80C5DBC5",
      "phase4_category": "existing_function_internal_entry",
      "semantic_classification": "return_continuation",
      "target": "0x829909A4"
    },
    {
      "action": "retain_owner_no_promotion",
      "owner": "0x829907F0",
      "phase4_candidate_id": "P4-CD2636F63FA03EE9",
      "phase4_category": "existing_function_internal_entry",
      "semantic_classification": "return_continuation",
      "target": "0x82990A0C"
    },
    {
      "action": "retain_owner_no_promotion",
      "owner": "0x82996508",
      "phase4_candidate_id": "P4-5C622F8CD642B0E2",
      "phase4_category": "existing_function_internal_entry",
      "semantic_classification": "return_continuation",
      "target": "0x8299681C"
    },
    {
      "action": "retain_owner_no_promotion",
      "owner": "0x829A1918",
      "phase4_candidate_id": "P4-478A3E67EE5B8D22",
      "phase4_category": "existing_function_internal_entry",
      "semantic_classification": "return_continuation",
      "target": "0x829A23D4"
    },
    {
      "action": "retain_owner_no_promotion",
      "owner": "0x829A1918",
      "phase4_candidate_id": "P4-B6536FF67085859B",
      "phase4_category": "existing_function_internal_entry",
      "semantic_classification": "return_continuation",
      "target": "0x829A23E4"
    },
    {
      "action": "retain_owner_no_promotion",
      "owner": "0x829A1918",
      "phase4_candidate_id": "P4-78A44D99F0F1C7BB",
      "phase4_category": "existing_function_internal_entry",
      "semantic_classification": "return_continuation",
      "target": "0x829A23F4"
    },
    {
      "action": "retain_owner_no_promotion",
      "owner": "0x829A2E70",
      "phase4_candidate_id": "P4-06B1819ADFF2E953",
      "phase4_category": "existing_function_internal_entry",
      "semantic_classification": "return_continuation",
      "target": "0x829A2E9C"
    },
    {
      "action": "retain_owner_no_promotion",
      "owner": "0x82A24238",